{
  "schema_version": "0.1.0",
  "operator_id": "org.latentdeck.builtin.ld_q4",
  "operator_version": "0.1.0",
  "trust": "builtin",
  "entrypoint": "latentdeck_operator_q4:process_slot",
  "supported_profiles": [
    {
      "codec_family": "minimax_h3",
      "profile": "h3_av_latent",
      "profile_version": "0.1.0",
      "timing_contract": "minimax_h3_causal",
      "timing_contract_version": "0.1.0",
      "layout": "[1,24,1,H,W]",
      "runtime_dtype": "F16"
    }
  ],
  "algorithms": ["LINEAR", "XS5"],
  "controls": {
    "algorithm": { "type": "enum", "default": "LINEAR", "values": ["LINEAR", "XS5"] },
    "interaction": { "type": "float", "default": 0.0, "minimum": 0.0, "maximum": 1.0 },
    "mode": { "type": "enum", "default": "HYBRIDIZE", "values": ["HYBRIDIZE", "INTERACT"] },
    "preserve": { "type": "float", "default": 0.55, "minimum": 0.0, "maximum": 1.0 },
    "influence_mode": { "type": "enum", "default": "MANUAL", "values": ["MANUAL", "TRIANGLE"] },
    "donor_weight_b": { "type": "float", "default": 1.0, "minimum": 0.0, "maximum": 1.0 },
    "donor_weight_c": { "type": "float", "default": 1.0, "minimum": 0.0, "maximum": 1.0 },
    "donor_weight_d": { "type": "float", "default": 1.0, "minimum": 0.0, "maximum": 1.0 },
    "triangle_x": { "type": "float", "default": 0.5, "minimum": 0.0, "maximum": 1.0 },
    "triangle_y": { "type": "float", "default": 0.3333333333333333, "minimum": 0.0, "maximum": 1.0 },
    "xs5_routing": { "type": "enum", "default": "TOPK", "values": ["TOPK", "SINKHORN"] },
    "temperature": { "type": "float", "default": 0.12, "minimum": 0.02, "maximum": 1.0 },
    "top_k": { "type": "integer", "default": 8, "minimum": 1, "maximum": 64 },
    "sinkhorn_iterations": { "type": "integer", "default": 5, "minimum": 2, "maximum": 12 },
    "chaos": { "type": "float", "default": 0.0, "minimum": 0.0, "maximum": 1.0 }
  },
  "limits": {
    "max_spatial_tokens": 4096,
    "top_k_max": 64,
    "sinkhorn_iterations_max": 12,
    "donor_count": 3
  }
}
